{
  "schema_version": "1.0.0",
  "updated_at": "2026-10-12",
  "current_phase": "3",
  "current_delivery": "0.34.0",
  "next_step": "نمای وضعیت پروتکل روزانه در ۰٫۳۴ کامل است: صفر مشاهدهٔ روزانه و پنجرهٔ اول ۱۳ اکتبر۱۴:۰۰UTC؛ سقف محلی از سهمیهٔ واقعی جداست. گام بعد دریافت دستی مجاز و بررسی کیفیت/پوشش مجموعهٔ daily است؛ خودکارسازی فعال نشده.",
  "phases": [
    {
      "id": "0",
      "title": "پایهٔ پژوهش",
      "status": "completed",
      "releases": "0.1",
      "criterion": "قرارداد داده، منشأ و زمان، نمونهٔ آفلاین و آزمون مستقل",
      "delivered": [
        "قراردادهای نسخه‌دار",
        "کنترل زمان دسترسی و منشأ",
        "نمونهٔ مصنوعی جدا از دادهٔ واقعی"
      ],
      "remaining": []
    },
    {
      "id": "1",
      "title": "ورود و کیفیت داده",
      "status": "completed",
      "releases": "0.2",
      "criterion": "دریافت قابل پیگیری و آشکارشدن دادهٔ نامعتبر یا مفقود",
      "delivered": [
        "سند هر دریافت و شمارش تراکنشی",
        "کنترل خام و اصلاحیه",
        "گزارش کیفیت و پوشش"
      ],
      "remaining": []
    },
    {
      "id": "2",
      "title": "نخستین دادهٔ واقعی",
      "status": "completed",
      "releases": "0.3",
      "criterion": "دریافت واقعی از منابع رایگان و ثبت محدودیت واحد و زمان؛ به معنی کامل‌شدن روش قیمت نیست",
      "delivered": [
        "API طلا و FRED",
        "منشأ و خام محفوظ",
        "تفکیک قیمت مرجع از OHLC"
      ],
      "remaining": []
    },
    {
      "id": "3",
      "title": "تاریخچه و شواهد زمان",
      "status": "in_progress",
      "releases": "0.4 / 0.5 / 0.7 / 0.8 / 0.23 / 0.29 / 0.33 / 0.34",
      "criterion": "روش قیمت روزانه، واحد، تقویم و زمان واقعی انتشار تأیید شوند",
      "delivered": [
        "هفت سری کلان و مرجع ماهانه",
        "اسناد انتشار و مقدارهای منتخب",
        "دفتر اصلاحیه و vintage",
        "دو سند BLS سال ۲۰۲۶ و نسخه‌های FRED در روز انتشار؛ زمان اولین دسترسی همچنان تأیید نشده",
        "تاریخچهٔ برآورد انتشار اول CPI فیلادلفیا برای ۳۳۵ ماه؛ هشت تطبیق منتخب با اسناد BLS، بدون تأیید ساعت تحویل",
        "نمونهٔ رسمی ۱۱۵ کندل ساعتی Bid طلا از Dukascopy با UTC و بررسی آفلاین؛ تقویم و واحد قیمت هنوز کامل تأیید نشده",
        "بررسی شروط Dukascopy و KID محصول: واحد محصول فعلی پشتیبانی می‌شود؛ اتصال پایگاه داده تا رفع محدودیت مجوز در انتظار است",
        "نمونهٔ دقیقه‌ای HistData سپتامبر: ۲۹٬۳۲۱ ردیف بررسی و به علت ۳۴۴ گروه زمان با مقادیر متعارض رد شد؛ رسید منشأ محفوظ است",
        "نمونهٔ مستقل اوت HistData نیز با ۹۸ گروه متعارض رد شد؛ بررسی تمام ردیف‌ها پیش از اعلام تعارض تقویت شد",
        "شاهد واقعی Spot با raw/hash و ساعت دریافت، parser و مسیر دستی ثبت پیشرو؛ منطقهٔ زمانی منبع و مجوز معامله تأیید نشده",
        "بررسی مستندات و شروط GoldAPI و کنترل آفلاین واحد/زمان/BidAsk؛ بدون نمونهٔ زنده یا اتصال معامله",
        "اولین نمونهٔ واقعی GoldAPI با HTTP 200 و کنترل موفق واحد/زمان/BidAsk؛ receipt و raw/hash خصوصی، بدون سفارش",
        "ثبت پیشرو دستی GoldAPI با یک درخواست، رد redirect، رسید مستقل و عدم بازنویسی؛ نمونهٔ دوم واقعی کنترل شد",
        "مجموعهٔ واقعی پیشرو با تطبیق کامل رسید/خام و گزارش فاصله، تأخیر و تکرار/تعارض؛ بدون پرکردن دادهٔ مفقود",
        "دسترسی واقعی تاریخچهٔ GoldAPI برای ۳۰ تاریخ سپتامبر و audit ترتیب/مقدار؛ هشت تاریخ آخر هفته و مجهولات واحد/session ثبت شدند، بدون ارتقای آمادگی",
        "سه پاسخ تاریخ‌دار GoldAPI منشأ LBMA، واحد صریح و قیمت برابر آخر هفته را آشکار کردند؛ با Spot FOREXCOM ادغام نشدند، دروازهٔ انتشار/مجوز محفوظ است",
        "پروتکل ثبت روزانهٔ مستقل: پنجرهٔ UTC، رزرو پیش از درخواست، lock، یک تلاش در روز و سقف محلی ۲۰ در ماه؛ هنوز دادهٔ daily جمع نشده",
        "نمای وضعیت پروتکل روزانه: تلاش ماه، سقف محلی، پوشش تأییدشده و پنجرهٔ بعد؛ مجهول بودن سهمیهٔ provider و snapshot صریح"
      ],
      "remaining": [
        "رفع ابهام تاریخ‌های آخر هفته و واحد قیمت",
        "قیمت روزانهٔ مناسب پژوهش بازده",
        "شواهد کامل زمان انتشار بدون نگاه به آینده"
      ]
    },
    {
      "id": "4",
      "title": "پژوهش روابط و رویدادها",
      "status": "partial",
      "releases": "0.6–0.8 / 0.24–0.27",
      "criterion": "نمونهٔ کافی، روش بازتولیدپذیر و آزمون زمانی مستقل برای پژوهش روزانه",
      "delivered": [
        "چهار رابطهٔ توصیفی ماهانه",
        "پیرسون، اسپیرمن و پنجرهٔ متحرک",
        "کنترل نمونه و مفقودی",
        "ثبات روابط در بازه‌های تقویمی جدا، با نمونهٔ مشترک و تفکیک روش قیمت؛ بدون ادعای پیش‌بینی",
        "فهرست ماه‌های حذف‌شده با متغیر ناقص و علت، متصل به گزارش مبنا",
        "استحکام نمونهٔ مشترک/دوتایی، حذف تک‌ماه و نمودار ۶۰ماهه با شکاف‌های صریح و JSON قابل بازتولید",
        "کاوش پراکندگی نمونهٔ مشترک با انتخاب ماه، شناسهٔ ورودی دو ماه و CSV هم‌دامنه",
        "طرح پیشنهادی نسخه‌دار مطالعهٔ CPI/اشتغال با پنجره‌ها، تفکیک زمانی و شروط توقف؛ بدون اجرای مطالعه"
      ],
      "remaining": [
        "مطالعهٔ واکنش روزانه با شواهد قیمت و انتشار",
        "آزمون پیش‌بینی خارج از نمونه؛ بدون ادعای علیت از همبستگی"
      ],
      "deliveries": [
        {
          "version": "0.24",
          "title": "ثبات دوره‌های ثابت و ممیزی نمونه",
          "status": "completed"
        },
        {
          "version": "0.25",
          "title": "استحکام ماهانه و پنجره‌های متحرک",
          "status": "completed"
        },
        {
          "version": "0.26",
          "title": "کاوش تصویری و شواهد ماه‌های نمونه",
          "status": "completed"
        },
        {
          "version": "0.27",
          "title": "آماده‌سازی طرح پیشنهادی مطالعهٔ رویداد",
          "status": "completed"
        }
      ]
    },
    {
      "id": "5",
      "title": "پنل پژوهش و تحلیل‌گر خوانا",
      "status": "completed",
      "releases": "0.9–0.22",
      "criterion": "گزارش مستند، پنل قابل استفاده و تحلیل چندمنبعی با تعارض و عدم قطعیت صریح",
      "delivered": [
        "گزارش هشت‌بخشی و مقایسهٔ نسخه‌ها",
        "COT و دریافت دستی همراه گزارش",
        "خلاصهٔ تغییرات و اولویت بررسی",
        "پشتیبان و بازیابی آزموده‌شده",
        "سلامت اجرا و راهنمای retry دستی",
        "رابط لوکال نمودار، گزارش و مسیر پروژه",
        "ضمیمهٔ محیط ساخت بستهٔ پژوهش و تلاش‌های HTTP جدید",
        "دریافت تازهٔ ۱۰ مرحله‌ای؛ دسترسی CFTC در این اجرا موفق",
        "جمع‌بندی مستند چندمنبعی با تفکیک اختلاف نسخه، روش و عدم مقایسه‌پذیری",
        "پشتیبان یکپارچهٔ پایگاه، خام، دریافت و شواهد HTTP؛ بازیابی سازگار با نسخهٔ قدیمی",
        "شروط پژوهش روزانه با شاهد گزارش و مدرک موردنیاز؛ آمادگی هنوز تأیید نشده",
        "ثبت محیط خود محاسبهٔ جدید با بازهٔ زمان و اتصال به گزارش؛ محیط خارجی و تاریخیِ بدون سند صریحاً نامعلوم",
        "شواهد محدودیت عمومی سهمیه و راهنمای retry؛ مصرف واقعی حساب و سهمیهٔ باقی‌مانده صریحاً اندازه‌گیری‌نشده"
      ],
      "remaining": [],
      "deliveries": [
        {
          "version": "0.13",
          "title": "دریافت دستی و گزارش",
          "status": "completed"
        },
        {
          "version": "0.14",
          "title": "تغییرات و اولویت بررسی",
          "status": "completed"
        },
        {
          "version": "0.15",
          "title": "پشتیبان و بازیابی",
          "status": "completed"
        },
        {
          "version": "0.16",
          "title": "سلامت عملیات",
          "status": "completed"
        },
        {
          "version": "0.17",
          "title": "رابط گرافیکی لوکال",
          "status": "completed"
        },
        {
          "version": "0.18",
          "title": "شواهد محیط و شبکه و دریافت تازه",
          "status": "completed"
        },
        {
          "version": "0.19",
          "title": "جمع‌بندی شواهد چندمنبعی",
          "status": "completed"
        },
        {
          "version": "0.20",
          "title": "بازیابی یکپارچهٔ شواهد شبکه",
          "status": "completed"
        },
        {
          "version": "0.21",
          "title": "شروط مستند پژوهش روزانه",
          "status": "completed"
        },
        {
          "version": "0.22",
          "title": "پذیرش پنل، شواهد محیط محاسبه و حدود سهمیه",
          "status": "completed"
        }
      ]
    },
    {
      "id": "6",
      "title": "قواعد تصمیم و آزمون",
      "status": "partial",
      "releases": "0.28 / 0.30–0.32 / آینده",
      "criterion": "دادهٔ مناسب، قواعد و هزینه‌های روشن، آزمون خارج از نمونه و حدود ریسک مالک",
      "delivered": [
        "موتور فنی با دادهٔ مصنوعی: سفارش در مشاهدهٔ بعد، کارمزد/لغزش، حسابداری و دفتر معاملهٔ فرضی",
        "زیرفاز فنی ارزیابی سایهٔ واقعی: تصمیم در زمان دریافت، کنترل تأخیر و warmup، خروجی حساب بدون سفارش؛ اجرا روی دو مشاهدهٔ واقعی",
        "حساب فرضی آفلاین روی دادهٔ واقعی با اجرای مشاهدهٔ بعد، هزینه/لغزش/stop و دفتر حساب؛ اجرای واقعی صفر fill به علت تأخیر",
        "پنل حساب فرضی واقعی با دفتر تصمیم/دلیل و خروجی JSON دقیقاً منطبق با موتور؛ عدم دستکاری Store و پیام شواهد نامعتبر",
        "مقایسهٔ جداگانهٔ سیگنال سخت/تأخیردار روی دو مشاهدهٔ واقعی؛ بدون تغییر شروط اجرا و بدون ادعای خارج از نمونه"
      ],
      "remaining": [
        "تکمیل دروازهٔ قیمت و زمان انتشار",
        "انتخاب قواعد و هزینه‌ها",
        "بک‌تست و سپس Paper/Shadow"
      ],
      "deliveries": [
        {
          "version": "0.28",
          "title": "آزمایش فنی حساب فرضی با دادهٔ مصنوعی",
          "status": "completed"
        },
        {
          "version": "0.30",
          "title": "ارزیابی سایهٔ مشاهدات واقعی و کنترل تأخیر",
          "status": "completed"
        },
        {
          "version": "0.31",
          "title": "حساب فرضی آفلاین واقعی با شروط زمانی و هزینه",
          "status": "completed"
        },
        {
          "version": "0.32",
          "title": "دفتر گرافیکی حساب فرضی با دادهٔ واقعی",
          "status": "completed"
        }
      ]
    },
    {
      "id": "7",
      "title": "اجرای واقعی اختیاری",
      "status": "not_started",
      "releases": "اختیاری",
      "criterion": "انتخاب کارگزار و مجوز صریح مالک؛ توقف اضطراری، تطبیق حساب و جلوگیری از سفارش تکراری",
      "delivered": [],
      "remaining": [
        "تصمیم مالک دربارهٔ اجرای واقعی",
        "کنترل‌های ریسک و کارگزار؛ هیچ اتصال فعال نیست"
      ]
    }
  ]
}
